{
  "refusalRecordId": "7ab18db0-84c0-4372-b13d-fa9bc38e84e2",
  "businessTransactionId": "2753b4a9-5f63-4681-adaf-6424938562b4",
  "decision": {
    "decisionId": "c2a567a7-4d23-4b04-832b-0a3632f2de7e",
    "intentId": "fc780ffb-763b-4901-be90-8722971461a8",
    "policy": {
      "name": "customer-refund",
      "version": "1.2.0",
      "schemaVersion": "1.0.0"
    },
    "signals": {
      "refundEligible": true,
      "managerApproved": true,
      "fraudCheckPassed": true,
      "refundAmount": 500,
      "approvalArtifact": {
        "payload": {
          "version": 1,
          "approvalId": "3d553391-8102-4f91-b01c-7cd5ac6f8416",
          "issuer": {
            "approverId": "manager-eval",
            "keyId": "manager-eval-key-1"
          },
          "issuedAt": "2026-10-10T19:07:31.732Z",
          "expiresAt": "2026-10-10T19:22:31.732Z",
          "capability": "paytm:refund",
          "resourceId": "order-eval-1",
          "scope": {
            "field": "value",
            "comparator": "lte",
            "value": 500
          },
          "nonce": "cd756e7c-c203-499e-91b0-1d57fe12adf5"
        },
        "signature": {
          "algorithm": "ed25519",
          "keyId": "manager-eval-key-1",
          "value": "wcdSWYsQdcT4EXuy7C/EgVseBjgOZxmAwCFGH5RM8EOsfXTIRp1ls2ygU4lnh58tsoyYdr7dm8Y6uSwFsbsHBA==",
          "signedAt": "2026-10-10T19:07:31.732Z"
        }
      }
    },
    "outcome": "REJECTED",
    "reason": "Rejected: declared signal(s) do not match independently verified state (managerApproved=true != verified managerApproved=false).",
    "matchedRuleId": "signal-state-verification-violation",
    "evaluatedRules": 0,
    "matchedPath": [],
    "evaluatedAt": "2026-10-10T19:07:31.852Z"
  },
  "evaluatedIntent": {
    "target": "paytm://orders/order-eval-1",
    "parameters": {
      "orderId": "order-eval-1",
      "transactionId": "txn-order-eval-1",
      "amount": 500
    }
  },
  "policyContentHash": "2a3a9534f0fe15d2d8e1a58b80044a09e78925c1849841af4fc2a6cc7ae78495",
  "createdAt": "2026-10-10T19:07:31.852Z",
  "refusalRecordHash": "c3fd35035cb8138b3901b6a9acfbb7607be7080de16f145076a1c90ac1e3de20",
  "signature": {
    "algorithm": "ed25519",
    "keyId": "default",
    "value": "D/c8ADosjK6SmnIQT5ast4rhhdr6ONIwXwOIV3sXn1PPhpch4IQV6OrPGlYMgCgTtSlFpgvnzHJwIRB0RQA2Ag==",
    "signedAt": "2026-10-10T19:07:31.853Z"
  }
}
